{"contract_version":"2026-09-04","evidence_hash":"sha256:8ade2959d8a370984e9d4065502add343b6be2a131b636152f5a98723a575245","evidence_ref":"evidence:measurement-progress","kind":"MEASUREMENT_PROGRESS","lineage":{"activation_record_hash":"sha256:b8e00983563e960b76b04eaf3a975ad227947f741d5e81510e22d6fc812dff1e","activation_record_ref":"activation:company-a","company_id":"tenant-a","environment_id":"staging-a","measurement_plan_hash":"sha256:df2e5052c7f662dd5e09f557cbf83566b52e1b73ecc306878d7fc3baabc8cdfd","measurement_plan_ref":"measurement-plan:crm-hygiene","outcome_contract_hash":"sha256:11d5f3995374ee639425ad2686ea3d6b0a20d12559d55e9bc43a7221e2c4c915","outcome_contract_ref":"outcome-contract:crm-hygiene","schema_version":"evidence-pack-lineage.v1","tenant_id":"tenant-a","window_identity":"window:crm-hygiene:2026-09","workspace_id":"workspace-a"},"predecessor_hash":"sha256:de3383a52632f64af3a64a16f08b8ad8e7cdb9e68d4d1ed201034900c81d01ef","predecessor_ref":"sha256:9720565e88b88dac193a842242b267b05e54ae3fbcefc0fe18db1cefde338b13","recorded_at":"2026-09-04T12:00:00.123456Z","schema_version":"evidence-pack-successor.v1","sealed_pack_hash":"sha256:60f6dfea91d30ff8b5f00e6a9e7cda3735e95ca1c0b864a4696a9314990b16c4","sealed_pack_ref":"evidence-pack:effect-1","successor_hash":"sha256:c43ded3b8b3feed45775cfd94cbef874e496be6015290dc3837de29f9f21c6b5","successor_id":"sha256:895b2743d69fc071f12a0b6a22ae84ffa3a2f3571fbc90e478fc32588e7efe7a"}
