{"contract_version":"2026-09-04","evidence_hash":"sha256:8ea626f1a21410afc15823682642cf7ecffd45a44d87c33386d464423e225a12","evidence_ref":"evidence:measurement-final","kind":"MEASUREMENT_FINAL","lineage":{"activation_record_hash":"sha256:b8e00983563e960b76b04eaf3a975ad227947f741d5e81510e22d6fc812dff1e","activation_record_ref":"activation:company-a","company_id":"tenant-a","environment_id":"staging-a","measurement_plan_hash":"sha256:df2e5052c7f662dd5e09f557cbf83566b52e1b73ecc306878d7fc3baabc8cdfd","measurement_plan_ref":"measurement-plan:crm-hygiene","outcome_contract_hash":"sha256:11d5f3995374ee639425ad2686ea3d6b0a20d12559d55e9bc43a7221e2c4c915","outcome_contract_ref":"outcome-contract:crm-hygiene","schema_version":"evidence-pack-lineage.v1","tenant_id":"tenant-a","window_identity":"window:crm-hygiene:2026-09","workspace_id":"workspace-a"},"predecessor_hash":"sha256:c43ded3b8b3feed45775cfd94cbef874e496be6015290dc3837de29f9f21c6b5","predecessor_ref":"sha256:895b2743d69fc071f12a0b6a22ae84ffa3a2f3571fbc90e478fc32588e7efe7a","recorded_at":"2026-09-04T12:00:00.123456Z","schema_version":"evidence-pack-successor.v1","sealed_pack_hash":"sha256:60f6dfea91d30ff8b5f00e6a9e7cda3735e95ca1c0b864a4696a9314990b16c4","sealed_pack_ref":"evidence-pack:effect-1","successor_hash":"sha256:0a6410299587f44e109f71ef459435a6e3fccb8a4899c08f26a52379ab3dc25e","successor_id":"sha256:7682395a3c57f1898484a5dec670da8e0615cb751ab69220abe279fb7c50ac3b"}
